access to your calendar to create event,add to calendar back,click add events get calendar provider start view calendar event managed profile get string set title append update,create events today,CALENDAR
our app will always notify you when it writes the information to your calendar we provide convenient features that allow you to add a reminder for any event directly into your personal calendar,browse events add to your calendar cancel,run background get events click set view add calendar get provider get title save update,"view and rsvp to public events, and add events to your phone calendars",CALENDAR
following permissions are required: calendar,view schedule add to calendar save changes,get provider set click listener click add calendar set title set time append update save,schedule service with your participating dealer,CALENDAR
our app will always notify you when it writes the information to your calendar we provide convenient features that allow you to add a reminder for any event directly into your personal calendar,add game to calendar,set click listener click start view calendar event managed profile append update save calendar,football game will be added to your calendar and update,CALENDAR
our app needs calendar permission to provide its functionality,preview select add to calendar exit,get content set click update calendar start view calendar event managed profile add calendar,This app provides class schedules,CALENDAR
"the calendar data is provided by our content partner schedjoules with whom the app communicates directly, no communication goes through any server by tapir appstapir apps runs the acalendar store as subscription service for public calendar data through google playprivacy policy for acalendar store",open schedule list open in calendar add schedule cancel back save to calendar,get calendar provider start view calendar event managed profile create schedule add calendar event append update,"you can view all schedules in calendar, or create a schedule.",CALENDAR
access your calendar and contacts,open calendar open event open map add events to calendar cancel go back,set preview start get content get instance start view calendar event,"access events, calendars, contacts, maps and more!",CALENDAR
"the calendar data is provided by our content partner schedjoules with whom the app communicates directly, no communication goes through any server by tapir appstapir apps runs the acalendar store as subscription service for public calendar data through google playprivacy policy for acalendar store",view all your classes add to calendar set reminders return save ,get instance start view calendar event manage profile set click listener click add class set time get availble location set set set,Download the app today to plan and schedule your classes,CALENDAR
"To read, add, or modify events, our app need to access your calendar",get events open calendar save event to calendar location time set reminder cancel save backup restore,set click listener click backup calendar set click listener click restore calendar get instance set time set location get available location set set set set instance get time zone get week year get time,"read, add or modify calendar events, also backup and restore calendar",CALENDAR
our app will always notify you when it writes the information to your calendar we provide convenient features that allow you to add a reminder for any event directly into your personal calendar,add to calendar set notification time location cancel save ,start activity run set click listener add bookings get instance set time set location set notification get time get week year get location set complete save,add your ticket bookings to your device's calendar to get notifications and integrate with your existing schedule,CALENDAR
our app need calendar permission to allow users to manage their schedules,open calendar view your schedules add edit return,set content get calendar get instance start view event calendar manage profile set click listener click add schedule set title set set time set set location get current location update ,"schedule management, display schedule on calendar",CALENDAR
permission needed: calendar,view your bookings open calendar go back,get instance set click listener click save booking calendar set time set location get available location set set set set instance get time zone get week year get time set complete,manage room bookings via calendar,CALENDAR
access your calendar is required for our app to provide full functionality,add to calendar set reminders set time set title save changes cancel return,get instance set preview set click listener click set notification get instance add calendar ,Set reminders for live broadcasts so you don 't miss a program you love,CALENDAR
permission needed: calendar,view event calander add event to calendar back,get instance set view start event calendar manage profile,the event calendar is also easily accessible from the app,CALENDAR
access your calendar and contacts,set time set location set notification add calendar mute event unmute event,set preview start run set click listener click import events calendar get instance append update set events set mute click mute event set complete,import your appointments to calendar and mark them as mute events,CALENDAR
"to set reminders for your upcoming event, the app will need access to your calendar. we do not upload or save your calendar data",add calendar set reminder cancel save,get instance set click listener click save booking calendar set time set location get available location set set set set instance get time zone get week year get time set complete,"set training calendars, reminders",CALENDAR
"in order to use our app, we need users to grant calendar access to our app",add to calendar set notification time location cancel save ,set content view start event calendar manage profile get instance get time,notification academic calendar events and institutional notices,CALENDAR
calendar access required,add events to calendar view details go back,set preview get content get instance set view start event calendar manage profile,check out what's on to plan your calendar and buy tickets to events,CALENDAR
"in order to use our app, we need users to grant calendar access to our app",set location view nearby events add open calendar,set content view set click listener click get event list get instance get availble location,find incidents near your calendar events,CALENDAR
"we may collect several sensitive information, such as calendar, location, etc.",open calendar upload cloud view details,get content start event calendar manage profile get instance,access to calendar to link up group member calendar,CALENDAR
"to set reminders for your upcoming event, the app will need access to your calendar. we do not upload or save your calendar data",add calendar set reminder cancel save,set content view get calendar start event calendar manage profile,calendar navigation giving easy access to previous scores and upcoming fixtures,CALENDAR
"we may collect several sensitive information, such as calendar, location, etc.",add to calendar set reminders set time set title save changes cancel return,set content view get instance start event calendar manage profile set preview set click listener click select event,show calendar events in agenda and select which calendars to show,CALENDAR
access your calendar and contacts,share facebook twitter view calendar add event to calendar title time location save cancel,start event calendar manage profile,access event and calendar information,CALENDAR
access your calendar and contacts,share facebook twitter view calendar add event to calendar title time location save cancel,start event calendar manage profile add calendar set time set title set location set get week time,add event directly to your device or share them with a friend,CALENDAR
our app needs calendar permission to provide its functionality,view all your classes add to calendar set reminders return save ,get instance set click listener click save booking calendar set time set location get available location set set set set instance get time zone get week year get time set complete,show the school calendar for better time and activity management,CALENDAR
access to your calendar to create event,add game to calendar,set preview get content get instance start view calendar event add games set time set get week time set title get string get displayed title save append update,display calendar and schedule of matches,CALENDAR
permission needed: calendar,view calendar events add to calendar time location title type cancel save,set content view start event calendar get instance click set priority get type set set get time,you can add priority events to the personal calendar on your device,CALENDAR
"to set reminders for your upcoming event, the app will need access to your calendar. we do not upload or save your calendar data",view calendar add save cancel,get instance start view event calendar manage profile set time set get weeks in week year,the calendar module displays all events occurring in the current week,CALENDAR
our app uses calendar permission to let users sync their calendar events,sync your calendar,set click listener click sync calendar get instance ,calendar sync,CALENDAR
the app needs permission to access your calendar. we do not upload or save your calendar data,view calendar add save cancel,get instance set click listener click start view event calendar manage profile add event set time set location get available location set set set set instance get time zone get week year get time set complete,make use and manage your calendar,CALENDAR
"required permission include, but not limited to, calendar",go calendar create a meeting cancel sync to calandar back,set content view start event calendar manage profile run background get instance set click listener click sync button set set set get week year get time append save update,one tap to create and sync a customer meeting with your calendar,CALENDAR
calendar access required,open calendar view event details add an event edit go back cancel,set content view run background start event calendar manage profile set click listener click add event get instance get time get week year set set ,"view, edit and update your schedules in calendar ",CALENDAR
"in order to use our app, we need users to grant calendar access to our app",open calendar upload cloud view details,get instance run background get first day week get time,the app will be used to announce important schedule updates and keep you informed throughout the four-day event,CALENDAR
access your calendar is required for our app to provide full functionality,create an events view calendar events,set content view set click listener click add event add get instance get set time get time set get week year set week date instance complete,create and check calendar events,CALENDAR
"required permission include, but not limited to, calendar",sync your calendar,set content view set click listener click view calendar start activity start event calendar manage profile get instance,access and sync your calendar anytime anywhere,CALENDAR
"in order to provide our service, calendar permission is required by our apps",open calendar show event details,set content view click open get instance start event calendar manage profile get instance set click listener click show details get time get location get availble location get week year get first day week,read calendar events you can get the list of calendar events with all details and descriptions,CALENDAR
access your calendar and contacts,add event view all events in calendar return ,set content view set click listener click add event get time set instance ,"can create calendar entries for birthdays, anniversaries and other events ",CALENDAR
"to set reminders for your upcoming event, the app will need access to your calendar. we do not upload or save your calendar data",set event reminders cancel,get instance set click listener click set reminder cursor instance set notification uri,making reminder,CALENDAR
"to set reminders for your upcoming event, the app will need access to your calendar. we do not upload or save your calendar data",set event reminders cancel,set content view start event calendar manage profile click add notification get instance set click listener click set reminder cursor instance set notification uri,add special notes to cards and personal reminders to your calendar,CALENDAR
"the calendar data is provided by our content partner schedjoules with whom the app communicates directly, no communication goes through any server by tapir appstapir apps runs the a calendar store as subscription service for public calendar data through google play",show events open calendar return,get preview create get instance get event calendar manage profile activity result ,While you can preview events in the a Calendar Store app,CALENDAR
"from a calendar event, store a connection in your calendar or e-mail it. our app uses contacts and calendar permissions, so offi can route you to your contacts or location",show calender return,set content view get provider run get instance ,"Contacts/Calendar, so Offi can route you to your contacts or location from a calendar event, store a connection in your calendar or e-mail it to your friends ",CALENDAR
Calendar permissions are required to perform certain functionalities,View all events Find local clubs,get calendar event get instance add set time get time,Add events you are going directly to your mobile calendar,CALENDAR
Read Calendar and Write Calendar,Enter Gallery Calendar Home Screen Exit,set content view run get calendar click view calendar events,Make use of the calendar button on the home screen to view and organize your events,CALENDAR
Read Calendar and Write Calendar,Calendar Home Page Quit,run get calendar event set view,"In this application, the confirmation of the latest event information and calendars",CALENDAR
access to user calendar,Add Calendar Events,create set content view get calendar get instance get time add event put extra,Add school events to your phone's calendar,CALENDAR
Our app requires read and write calendar permissions,Calendar Home Page Quit,create set view get event click start view calendar event managed profile click get provider set add event,Calendar management,CALENDAR
access to user calendar,Add Calendar Events,create generate key get calendar get instance get time add event put extra,Add school events to your phone's calendar,CALENDAR
Our app requires read and write calendar permissions,Backup Backup/Restore Create a backup of the encrypted database,click get calendar event set content run get instance ,WRITE CALENDAR : To write user schedule in android system,CALENDAR
Our app requires read and write calendar permissions,Backup Backup/Restore Create a backup of the encrypted database,date get instance insert event put extra start activity,READ CALENDAR : To show user schedule in application,CALENDAR
Read Calendar and Write Calendar,Calendar Home Page Quit,create click run get calendar get time add,Appointments are retrieved from your different Google calendars,CALENDAR
We need to access calendar to provide our service,Events Large Text Open Calendar,run set active calendar get instance add event set time get context,A simple yet useful calendar app for Persian (Jalali) calendar system-sync with Google Calendars and show events,CALENDAR
"In order to use the app's augmented reality feature, we will require access to your device's camera. The image captured by the camera is used to identify the piece of artwork and display information about the piece and the artist. ",open camera aim camera to art,get device id get camera open camera,Just walk around the hotel and point your device's camera at the piece of art you'd like to learn more about,CAMERA
Camera permission: This permission authorizes the app to take photos using Your device's camera. The captured images are used as visual identification of Your belongings.,Open camera,get get device get camera open camera open camera ,Custom camera to help selecting the item on the picture,CAMERA
"our services would ask you for your permission for letting the app read as well as have an access to your camera, microphone",scanning put barcode into the yellow box,set click listener click get device get camera parameter get camera open camera run ,These fields can be opened in barcode scanner or camera as soon as they are focused,CAMERA
"The apps of Camera are using this permission : android.permission.CAMERA . This because this application will record camera sensor and microphone data, which is used for the purpose of taking photos and recording videos. ",open gallery take picture,click get camera open camera set camera parameter take picture take picture take picture,Select your image from gallery or take a picture using camera.,CAMERA
Our products may request your permission to access your smartphone's camera to take picture.,Open camera,get device get camera set camera parameter open open camera open camera take picture,Choose an image from the gallery or take from the camera.,CAMERA
You may access device Camera (Rear & front) and Gallery in order to use our applications.,Take picture Open gallery share,get camera open camera click capture capture image take picture,Take a selfie or Capture a picture with Camera or Select your photo from gallery,CAMERA
"If our application our requires special permission from you like, camera,network access etc, its used only for application work properly on your device.",take picture gallery select effect apply cancel,get device get camera open camera capture image take picture set effects set frame set color effects save destroy,"Choose a photo from your gallery or take it with the camera of your device, select a frame and generate your photo",CAMERA
"In Events where Facial Recognition is enabled by the Admin, the users have an option to click and share their selfie from their mobile phone camera, using which we call the Amazon AWS Facial Recognition API.",take picture share open gallery select cancel,click get camera setup camera take picture set click listener click share open gallery open camera,"Use camera to take pictures, share your photo from gallery or taken from camera.",CAMERA
This app uses device camera for capturing photos.,select camera take picture open gallery,select set destination get device open camera capture image take picture,"Alternatively they can add photos from the app, using the Smartphone's camera at the destination",CAMERA
"The app needs to access the camera to scan barcodes, and also to take photos if you want to link a photo to an item in your database. The app never accesses the camera sensors except you request it from the app.",scanning,set click listener click click get camera start scan open camera run,The camera on your device is used to scan barcodes and look up item information,CAMERA
"Fun Camera Apps request and collect any of the following permissions or sensitive user data: camera, microphone, accounts, contacts, or phone.",open gallery open camera,get device status get camera take picture set color effects ,"Taking selfies, edit photos with different effects.",CAMERA
This app requests permission to use device camera.,open camera take photo start recording pause stop recording save cancel,get camera open camera take picture switch camera get color effect set white balance set quality,Capture photos and videos in high resolution HD quality,CAMERA
This app requests permission to use device camera.,open camera take photo start recording pause stop recording save cancel,get camera open camera switch camera start video recorder close camera get color effect set white balance set quality,Capture photos and videos in high resolution HD quality,CAMERA
Camera permission allows us to use your device's camera to take photos for the frames.,open gallery take picture effects apply cancel,set click listener click set camera get device get camera open open camera take picture,select photo from gallery or from phone/camera and apply various effects,CAMERA
"Our services access your device's camera and gallery to enable photo/video taking and editing functionalities. With your consent, we access your device's camera and photos.",switch to front camera take photo,get camera set camera parameter click take pictures,permissions for photo-taking: using camera to take photos and selfies.,CAMERA
cameras are used to capture audio and video data.,open camera switch video/photo modes take picture record video,open camera click click take picture,take pictures,CAMERA
cameras are used to capture audio and video data.,open camera switch video/photo modes take picture record video,open camera click click open long click record video start recording stop recording release destroy,shoot videos and snapshots,CAMERA
"For devices with Android version prior to 6.0 (Marshmallow), the application requires camera permission to turn on and off the camera flash.",select camera take photo landscape mode portrait mode night mode ,run get device open camera set torch mode turn on flash light,"May be used as a coarse stroboscope, with limitations due to device hardware, on devices that support fast turning on/off of the camera flash",CAMERA
permission to take pictures and record video self explanatory you give permission to the application to capture photos and videos through your camera ,video start recording stop pause save to album select select all delete,setup get device get camera set click listener click request permission access click open long click start recording stop recording destroy release,record videos with your camera,CAMERA
permission to take pictures and record video self explanatory you give permission to the application to capture photos and videos through your camera ,video photo portrait take picture save photo share select contact select select all delete,setup get device get camera set click listener click take picture set color effects set effects share request permission access redirect facebook redirect twitter redirect inst,Take pictures with your camera,CAMERA
Camera permission allows us to use your device's camera to take photos / videos and turn ON/OFF Camera Flash.,gallery select take picture choose effect button,get device get camera parameter setup open camera take picture,Select a photo from phone gallery or take picture using the phone camera,CAMERA
"We use camera permission in order you pick the photo or image to edit from your camera, your files or Google Photos app.",switch to rear front camera take photos edit choose effects,get device get cameras select camera open camera set click listener click take picture,"Make selfies or photos with the front or rear camera, edit photos.",CAMERA
"Take photos by user's device camera. To help you access and use camera to take pictures, record Video.",select camera take picture open gallery,capture open camera take picture,"Take, select, and edit your pictures.",CAMERA
camera is used in real time.,open camera tap or press for photo or video,get camera open open camera auto focus set preview size set picture size click take picture ,Tap to take a photo,CAMERA
camera is used in real time.,open camera tap or press for photo or video,get camera open open camera auto focus run start start recording video pause resume stop video recording stop recording,press and hold for taking a video,CAMERA
Our products may request your permission to access your smartphone's camera to take picture.,take picture gallery select cancel,get camera info get camera open camera take picture,Can choose an image from the gallery or taken from the camera.,CAMERA
The applications access the camera only when the user activates barcode scanning with the built-in camera.,start camera,get camera set set run open camera scan start,Barcode scanning with built-in camera supported,CAMERA
"The images you take using camera, or if you use any image from gallery, will remain inside the app only, we do not have access to any of your images.",tap camera icon to start,click create view holder unbind icon set click listener set set icon take picture save,Take better photos is one of the best selfie camera app with multiple features,CAMERA
"When you elect to??allow it, some of our mobile applications have access to??the??camera.",start camera,start get camera device id set torch mode,This app need access to your camera.,CAMERA
Camera permission allow us to to take pictures and create videos through the permission Camera????which is granted by user for photo effects and video play pause or for photo frames effects or may be to save and share his/her pictures.,Add Text Font Colors Layout Background Border Add Filter Add Effect Add Frame Save Cancel Share,capture open camera take picture add text add tag choose font save,Directly import photo from gallery or quick access from camera for 3D text,CAMERA
This app need to access to camera to take photo.,Take a beautiful selfie with front camera Take picture filters edit apply save to album silent mode,create action view set action update menu view icon click take picture,"Take beautiful selfies anytime, anywhere by applying filters and that too in silent mode",CAMERA
"The app may also request access to sensitive permissions, for example, your device camera.",start camera,get camera set camera parameter get camera device,"Open the application, press ""Start"", and point the camera.",CAMERA
