Read contacts to Retrieval of data for displaying the upcoming birthdays of your contacts.,Settings Home Screen Upcoming Birthday Anniversary Date,get contact create birthday notification ,"READ_CONTACTS to read your contacts, Home screen widget displaying the upcoming birthday and anniversary dates of your contacts",CONTACT
Our service also need access to your device contact to add people from your device address book to skype contact list,video chat call select contact share,start call invite get contact ,"Simply tap on the call tab on Skype Lite, and start the group call with your friends on Skype Lite.",CONTACT
The ContactsPoint App provides a way for users to import their contacts from an old mobile phone into the Smartphone where the App is installed and used.,Import Contacts Contact transfered from your old device,process queue save contact run ,This application allows you to transfer within a few seconds all your contacts to your new phone.,CONTACT
"For a better experience while using our Service, I may require you to provide us with certain personally identifiable information, including but not limited to address camera, location contacts and storage. ",Contact Generate QR Code ,click launch contact activity create qr,"Barcode and QR scanner can scan and read all QR / barcode types including contact, email, and many other formats.",CONTACT
The numbers to be contacted are downloaded to the phone and dialed using the native dialer.,Name Telephone ,start activity result click get contact info,"Activate your astDial account, upload contact on cloud",CONTACT
"The App is a platform for the synchronization of contact data of users. In order to guarantee the functioning of the App, it is indispensable that the App gets access to contact data/address book of the user's device and that the users keep their data up to date.",Loading contacts Add Contacts ,get contact information get contact id modify contact delete contact insert new contact,"The phonebook Contacts App helps you to modify, delete and insert contact.",CONTACT
"VshGap can optionally discover which contacts in your address book are VshGap users, using a service designed to protect the privacy of your contacts. Information from the contacts on your device may be cryptographically hashed and transmitted to the server in order to determine which of your contacts are registered.",Create Group Add Select Contacts Start Group Chat Invite Contacts Share with Contacts,load resource get contact open contact photo input stream ,"You can send an unlimited amount of messages, photos, videos and files of any type to your contacts and have group chat with up to 200 contacts at a time.",CONTACT
"Contacts: Some of our App(s) uses this permission to provide some functionalities such as view or edit existing contact(s), add new contact(s) or delete contact(s) as per your action taken from our App(s).",Contact Details Name Address Phone Number Share Contact Add Favourite Contact ,click activity result get contact data get contact details get name get address get phone number set click listener click share contact set click listener click add favorite,This app uses Read Contacts permission to read contacts per your action taken.,CONTACT
"Contacts: Some of our App(s) uses this permission to provide some functionalities such as view or edit existing contact(s), add new contact(s) or delete contact(s) as per your action taken from our App(s).",No Contacts Found Click on + button to add contacts ,set click listener click add contact append update set text get content resolver ignore case value ,This app uses Write Contacts permission to add/delete contacts as per your action taken.,CONTACT
"READ_CONTACTS, WRITE_CONTACTS: for internal use for the purpose of assigning the ringtone to desired contact",Set ringtones for contacts Select Contacts Save,click set ringtone assign contact get contact by name,"READ_CONTACTS, WRITE_CONTACTS: for internal use for the purpose of assigning the ringtone to desired contact",CONTACT
"We may request access or permission to certain features from your mobile device, including your mobile device's contacts, and other features.",create contact csv file update import contact from file,start call resume start next selected call update list view selection post execute post execute start task handle result post execute start next call get selected contact call context item selected handle call record result get post execute set current call ,You can import thousands of contacts into separate groups from a spreadsheet (CSV) in seconds.,CONTACT
This app(Multilanguage Keymap Redefiner) use read contact permission. This permission needed for autocompletion when you are using on screen keyboard.,Use names from Contacts for suggestions and corrections,get contact info get contact name,READ_CONTACT permission needed for autocompletion when you are using on screen keyboard.,CONTACT
"Contact Permission: Access to get contacts id. Through contacts id, one can set Contact image URI(Uniform Resource Identifier) and set Ringtone audio URI Directly from application.",Backup Contact List Restore ,get photo background execute background click fetch contact id phone number get photo ,"Recover Deleted All Photos, Files And Contacts.",CONTACT
"Should Customize My Phone request and collect any of the following permissions or sensitive user data: microphone, camera, accounts, contacts, or phone",Horror Ringtones Scary Sounds Set as ringtone Set as contact ringtone Set as notification Set as alarm tone Share this super cool app Get more apps ,get stream get contact photo stream get stream content assign ringtone contact save update,"Set as a ring tone, SMS notification alert, alarm sound or assign it to specific contacts",CONTACT
"AHS Studio may ask its users to allow access to various features of their smartphones such as camera, microphone, contacts and location solely for the purposes of aligning with the features of our services and products.",Add To Favorite Cancel ,set click listener execute click get contact list add to favorite,You may create favorite contact list for privacy or may put contact list in the privacy to secure your contact while ring.,CONTACT
Need personal data such as contact permission,Contact info on your device ,set click listener get account get detailed contact list click get background get contact cursor get contact cursor execute open account file update data bound share click ,Edit contacts and add notes to the people you meet.,CONTACT
"Our application get user's family/friends phone number and save into the application, Which means it makes the user to enter the individual contact to store in the application",Select Contact Show Contact Numbers,activity result get contact details get contact number display,this app uses permission to read the contact and make user's to pick individual contact to store in the application,CONTACT
"The Application requires permission to get user contact list to share resources (people and their info, ex. phone) among projects.",Share Choose a Contact Choose a Phone Number,click share get contact open input stream,PERMISSION for reading contacts: It allows you to share the same resources accross multiple projects.,CONTACT
"This type of service makes it possible to manage a database of email contacts, phone contacts or any other contact information to communicate with the User.",Import Contacts,activity result set click listener click get contact details,Import persons from your contacts or a Google spreadsheet,CONTACT
We Read your contacts: Revolutionx Apps does not save or upload your contacts.,Announce Caller Name Announce Sms Sender Name Announce Sms Content Volume Languages Settings Do not annpuncer list More apps Rate us ,retrieve contact number activity result get contact name announce receive get stream get contact photo stream get stream content ,You can create list from your contacts to exclude them from caller name announcement.,CONTACT
Accessing device contacts to use the function of importing phone contacts and saving card to contacts,Contact Info Company Info More Loading,save phone click replace cam card system contact save account get provider execute system v card entry background save get device account type click get device id,Easily export contacts to Excel files,CONTACT
"With your permission, we may also access other personal information on your device, such as your phone book or calendar, in order to provide services to you.",New phone number Add new contact Ignore ,show contact list get contact add new contact update append set text set get content resolver,"CREAM assistant is also a base of your contacts, which can be quickly created and organized.",CONTACT
We request access to your contacts to display a local contact list inside the Teo Softphone,select contact assign ringtone,get list phone number get ringtone get phone number get data cursor get contact save,Set ringtones avatars for your contacts.,CONTACT
Some of our applications may use this permission to read your contact information when you request. We do not collect or share this information. We use this permission to announce caller name or to display dialed / received calls / missed calls when you request.,Recover Deleted Contacts Click Contact To Restore ,click restore item selected show get item selected restore menu item click restore contact item,"This application can restore all your MANUALLY deleted Contacts, and synchronize your all contacts",CONTACT
"Interactions that you have with other users or content on the Service, and When you give us authorization, contact information of your friends from your mobile or tablet devices to connect your contacts and address book information with your Tinker account. If you choose to use the Service to invite one of your contacts to use the Service, we will send your friend an email or SMS inviting them to visit the Service.",Please grant Tinker permission to access contacts on your phone. GRANT PERMISSION No Contact ,get contact get input stream load ,"syncs with contacts and you're ready to go, add your favorite contacts in app home screen to make the call within a couple of touches.",CONTACT
android.permission.READ_CONTACTS (read phone contacts) necessary to be able to make phone calls from the application,All Contact Sim Card Contact Save Exported Contact,set click listener click start get phone contact run background,this app need to read contacts from the device.,CONTACT
Reasons to request contact permissions is required to read and transfer contact data via Bluetooth.,Backup Contact Select Contacts,click select contact run get contact list get lookup ,READ CONTACTS: Required to display and read contact information.,CONTACT
Reasons to request contact permissions is required to read and transfer contact data via Bluetooth.,Backup Contact Select Contacts,run save contact set string set append update ,WRITE CONTACTS: Required write contact information.,CONTACT
the App may access your saved contacts only for purposes required for the proper functionality of the App such as matching incoming calls and filtering out already known callers from the App's main screen.,No Contact Found,receive get contact name ,this app requires read contacts.,CONTACT
the App may access your saved contacts only for purposes required for the proper functionality of the App such as matching incoming calls and filtering out already known callers from the App's main screen.,Create New Contact Save Contact Edit Cancel,selection parse build run get header field get value append get default start insert path size add create contact append send data,this app need write contact permission to create new contacts.,CONTACT
"We may also collect information about others if you use our Services to upload, share and/or distribute Content that contains information about them, including their name, image and online contact information.",Recover Deleted Contacts ,choose activity click add historical record persist historical data background background execute executor ,Contact Recovery can restore your deleted contacts from your internal phone database and restore them in the original Contact thread,CONTACT
android.permission.READ_CONTACTS : To make a QR code for your contact.,ADDRESSBOOK Select from your contacts PHONE Create for phone number EMAIL Create for email address LOCATION Create QR for location URL Create QR for web URL TEXT Create QR for text contents APPLICATION QR for installed applications ,click start activity put extra set type add ,"QR and Barcode Scanner can scan and read all QR / Barcode types including text, url, ISBN, product, contact, calendar, email, location, Wi-Fi and many other formats.",CONTACT
Read Contacts - To load/show contacts for the purpose of setting ringtone for individual contacts. Write Contacts - To set ringtones for contacts.,assign ringtone to contact,click assign contact create cursor text get contact content,read & write contacts- to assign ringtone for a specific contact.,CONTACT
"Should High Quality Applications request and collect any of the following permissions or sensitive user data: microphone, camera, accounts, contacts, or phone",Top Ringtones Set as ringtone Set as contact ringtone Set as notification Set as alarm tone Share this super cool app Get more apps ,get stream get contact photo stream get stream content ,Assign different ringtones and notifications to specific contacts from your phonebook,CONTACT
Contacts- the app may require access to your phone book to automatically fill in some required information for the QR code. ,Password create Create Owner details* Owner details Emergency contact* Emergency contact Health care proxy Health care proxy: Health information Health information ,share result get contact data address book get owner data address book.,"Share the name and contact details of the phone owner, and the emergency contact details",CONTACT
"Read Contacts of User. In order to connect you with your friends already using VoMail , access to your contact list on this phone will be necessary.VoMail will not share this list with anyone.Your contacts will be periodically accessed for any new additions in the contact and sync your friends with VoMail services. ",Find from contact book,check permission get contact list get contact data,We ask permission to access your contact list so that you will know who among your friends is also using the app.,CONTACT
You may also ask us to import your contacts by giving us access to your Device(s),Select contacts to share Call Log is shared.,load resource backup contact load resource update contact load resource open contact photo input stream.,"To read/write Call Logs and Contacts is required to backup, access, and restore your call history and contacts.",CONTACT
"Read contacts: The App makes use of this permission in order to fetch contact data, including, but not limited to, the name or birthdate of the contacts. This information is used to show to the final user birthdate related information about their contacts. In any case this information is saved or sent by The App.",Add Contact Update Contact Edit Contact,get data get contact data,"This application uses the data of your contacts on your phone, keep all your data if you change your device!",CONTACT
Permission to access contact information is used when any of the apps need to look up a contact to identify the caller.,Speak name for contacts,get contact name receive ,Settings for enabling or disabling telling names of contacts or unknown numbers both for call and message,CONTACT
"See, edit, download, and permanently delete your contacts"" - in case you want to synchronize EssentialPIM Contacts with Google Contacts",List is empty. Create new,click update contact data import c v click notify data set handle message edit start delete contact data update activity open photo create contact data run process next message process edit send message ,It allows you to manage Contacts. Wide selection of fields and unlimited number of contact groups that can be organized hierarchically.,CONTACT
"Should My Ringtones and Sounds request and collect any of the following permissions or sensitive user data: microphone, camera, accounts, contacts, or phone",select contact choose Ringtones set cancel,activity result assign ringtone select contact,"Set as a default ringtone, contact tone, SMS notification or alarm clock sound",CONTACT
Blue Ray does not save or upload your contacts. Permission to access contact information is used when you search contacts in Blue Ray search bar.,Select Contact Call Send SMS,click get contact list,"This App uses permissions of usage access, read contacts for secure the call and read phone state for call.",CONTACT
"For a better experience, while using our Service, I may require you to provide us with certain personally identifiable information, including but not limited to android.permission.READ_CONTACTS.",SMS template Edit Edit template E-mail template Share template Share type Sharing Share type ,click get contact send sms send email share,"You can send SMS, Email with preselected contact person/persons or share as text with other applications installed on device.",CONTACT
The Epic Data App will quietly and automatically update your contact database on changes to your friends contact data.,"1 START: IN YOUR OLD PHONE Enter an Email Address and Password below, then click the ""OLD PHONE"" button OLD PHONE 2 FINIAH: IN YOUR NEW PHONE Re-enter your Email Address and Password above, then click the ""NEW PHONE"" button NEW PHONE Forgot Password * This app can transfer contact data",add update contact add contact group get group id run,we upload your contacts to your own password protected cloud account,CONTACT
Contact Permission is only required to display Contact Name in SMS and Call Log and to convert them into PDF.,"Generated PDF will include number of SMS being sent/received on daily basis. ""You can easily print Call Log SMS Chat of any contact from 'Specific Contact Log' Export to PDF Select any contact to generate PDF",execute executor background fetch background validation button verify get contact name number temp get call log data ,"E2PDF allows backup of sms, contact, select any contact and get PDF backup of Call Log and detailed SMS conversation/ SMS chat of your loved ones.",CONTACT
"We may only use contact information of your address book, if you agree to provide it to us, for the limited purpose of sending them an invitation to use the Service or other products of our company",Select Contacts Import,set click listener execute parallel add record execute click get contact save b show show background click persist historical data ,Share business contacts and Import or Export business contacts,CONTACT
"With your permission, we may also access other personal information on your device, such as your phone book, calendar or messages, in order to provide services to you.",contact information name company email number back,decode stream decode get input stream get contact,this app uses permission to read the contact,CONTACT
"Should Ringtones And Sounds request and collect any of the following permissions or sensitive user data: microphone, camera, accounts, contacts, or phone",Amazing Ringtones 2017 Set as ringtone Set as contact ringtone Set as notification Set as alarm tone Share this super cool app Get more apps ,get stream get contact photo stream get stream content assign ringtone contact save update,assign the ring tones to your contacts,CONTACT
Permission to access contact information is used when you search contacts in LASHPASH APPS search bar.,Show Contact List Select Contact Unknown Contact,main method activity result get contact,This App uses permissions of read contacts.,CONTACT
"""Contacts Transfer"" app uses permission READ_CONTACTS, WRITE_CONTACTS to write the phone book into android device.",view the contacts,click get contact list execute select contact get contact details,"Press button ""View the contacts"" to view the list of contacts.",CONTACT
We ask your permission before syncing your contacts. We store your up-to-date contacts in order to notify you as soon as one of your contacts signs up for Telegram and to properly display names in notifications. We only need the number and name (first and last) for this to work and store no other data about your contacts.,Telegram needs access to your contacts so that you can connect with your friends across all your devices. Your contacts will be continuously synced Delete Contact Block Contact Add Contact,check permission add contact phone book run read phone book delete contact update contact,"You can decide if to synchronize contacts for each account, and delete synchronized ones from Telegram servers.",CONTACT
CHRIS WILLIAMS APPS does not save or upload your contacts. Permission to access contact information is used when you search contacts in CHRIS WILLIAMS APPS search bar.,enable announcer change annoucement language,main method get contact list get contact details get name get number,Caller name speaker and announcer uses permission to read contacts for speaking the incoming caller name.,CONTACT
The usage of the permission android.permission.READ_CONTACTS is to make a QR code for your contact.,create contact qr code,click open contact system get contact ,Create QR from contacts or bookmarks for your friend to scan it on their device,CONTACT
READ_CONTACT: Get the phone number to create QR code with contact,Get Contact READ_CONTACT: Get the phone number to create QR code with contact type,click select contact,Create QR from contacts or bookmarks for your friends to scan on their device,CONTACT
The Contact Saver Application stores all contact information within the Application or on SD Card for backup purposes. By using the application you adhere to such use of your information.,Save Contact Backup Contact Import Contact Export Contact,click save save contact click backup contact click import contact,"Load, save, delete, backup or retore contacts from phone or SIM card.",CONTACT
"Should Marshmallow Melodies request and collect any of the following permissions or sensitive user data: microphone, camera, accounts, contacts, or phone",Free Music Ringtones Set as ringtone Set as notification Set as contact ringtone Set as alarm tone Get more apps Share this super cool app ,get stream get contact photo stream get stream content ,ASSIGN DIFFERENT RINGTONES TO SPECIFIC CONTACTS,CONTACT
"Our apps and games offer social sharing features and other integrated tools, which let you share actions you take in our app or game with other media. The use of such features enables the sharing of information with your friends or the public, depending on the settings you establish with the entity that provides the social sharing feature.",Arabic Ringtones Set as ringtone Set as contact ringtone Set as notification Set as alarm tone Share this super cool app Ad Get more apps Privacy Policy Withdraw Consent ,load resource select ringtone pick contact open contact photo input stream assign ringtone contact,"Set these sounds as SMS ringtones, alarm sounds, contact ringtones or notification sounds",CONTACT
"If you choose to use the Service to tell a friend about us, we will ask you for and store your friend's email address and/or phone number. We also might ask you to access your phonebook, Facebook, Twitter, Google+, or other social media sites contacts for this purpose.",Please grant Azadi permission to access contacts on your phone. Select Contact No Contact ,get contact list get input stream load,sync your contacts or add contacts to favorite list,CONTACT
Some of our applications may use this permission to read your contact information when you request. We do not collect or share this information. We use this permission to announce caller name or to display dialed / received calls / missed calls when you request.,Contact List Backup Contacts Sync,recover historical data get contact display contact photo,Back up your contacts and sync them across all your devices.,CONTACT
"Should Ringtone Station request and collect any of the following permissions or sensitive user data: microphone, camera, accounts, contacts, or phone",EDM Ringtones DJ Remix select contact save cancel,activity result set click listerner click set ringtone get contact list get content resolver append,"Choose awesome sounds as dj beats for your short message for notification tone, or some long ringtones that you can set as contact ringtone.",CONTACT
"from a calendar event, store a connection in your calendar or e-mail it. our app uses contacts and calendar permissions, so offi can route you to your contacts or location",calender return,run get instance ,"Contacts/Calendar, so Offi can route you to your contacts or location from a calendar event, store a connection in your calendar or e-mail it to your friends ",CONTACT
permission used: read contact. we may access to your device's contact book to provide relevant service.,select backup cancel go back,set content view get external file directory click backup get message body string run background ,"Securely backs up contacts, messages, call logs to Bkav Cloud or SD Card ",CONTACT
"permissions used in our app: receive, read, and send sms",edit add number send save draft cancel,get string check permission set click listener click send text message,read sent and received SMS messages,CONTACT
"read_contacts&write_contacts this permission is necessary because app can help you manage ringtone of contacts , assign different ringtone to each contact",set ringtone save changes cancel,get preview click set ringtone get contact details,"app can help you manage ringtone of contacts , assign different ringtone to each contact ",CONTACT
