"We may collect your location information to add geo tags to the photos and videos you take on our services. With your consent, we may collect such information through GPS, wireless network, wifi network, etc. You can revoke your consent or turn off geo tags by changing your location permissions in settings.",current location search get distance exit,get last known location get time new location get night mode request location update,You can use your current location or any other place as starting point for distance calculation,LOCATION
"When you open the Application, we may use GPS technology (or other similar technology) to determine your current location and display a location map.",Starting up?? Get Location GPS Data Send,request location fill start observing make background job make background job wakeful work get location handle get speed,Send GPS Location from the Field,LOCATION
"When you use the mobile application, we do use GPS technology (or other similar technology) to determine the device speed, this is the core functionality of the application.","Please turn on GPS/Location first from your settings menu, to be more accurate get your location. Change Location",get current location run get distance run get direction,Qibla direction from your location,LOCATION
"Location data are used to provide the user with information about cultural assets and events in his proximity. Location data can be stored and subsequently analyzed to provide better and more accurate location services, also based on the user preferences.", Search Start Add NET GPS  ,get provider location run get speed run get accuracy location provider disabled get time provider run status status get status,GPS Tracking,LOCATION
With respect to the Personal Data used in the Service we only collect IP Addresses and certain coarse geolocation and Internet Service Provider information associated with that IP Address.,Tap the dialer to call your friends and family. Turn On Your Location Settings,play get advertising run limit log event sync run send session event get name log event sync get country location start new session start new session get longitude get latitude,Geo Location Based Calling,LOCATION
"We may collect and process your location data to provide location related Services and advertisements. For example, some add-ons or offers may be available at dedicated locations. The location data is processed?? and stored only for the duration that is required for the provision of the location related Services.",Turn On/Off Location,run get last known location,"GO Switch Widget provides you a fast way to turn on/off the functions in common use, such as Wifi, GPS, brightness, screen lock,flashlight, battery etc",LOCATION
"In some cases we collect and store information about where you are located. This may be accomplished by converting your IP Address into a rough geolocation, or by requesting location information from the device you are using to access the Services.",Enalble GPS Location Settings,set location request update run start get altitude run get current location background,Build your custom widget with GPS,LOCATION
"As an integral part of providing the Services, we may use GPS, or other technology to collect geolocation data that tells us your current location.?? This allows us, for example, to assist you with finding parking, or provide you with an interactive map of the park.","get current location Your location will stop broadcasting when the timer runs out, but you can also stop sharing your location at any time by launching the Glympse app and choosing Expire on your Glympse ",get provider run get last known location,Glympse Keyboard is the fastest way to share your location from within any app,LOCATION
"Track the distance covered, working duration, battery percent, real-time location, GPS position of your executives. Play their entire route with the click of a button.",Search Voice Search Find Location,get latitude get longitude get last known location, scan the area for the nearest professional coworking places,LOCATION
"Certain features available in the Service may allow or require us to obtain your location information, including GPS coordinates in real time ( 'GPS Location ').",Settings GPS ,get accuracy set longitude set latitude get longitude get latitude get time,"location base mobile application as one of the tools to help in buying, selling or renting property",LOCATION
"Whenever you use our App, Site or Service, we may collect non-identifying information from you, such as your IP address, interactions with the App, Site and Service, query information, location, referring URL, browser, operating system, cookie information, usage, data transferred, and Internet Service Provider",Search Location permission has been granted,get latitude get longitude update location invalidate position user location enable follow location set user location location draw location enable start location provider set user location mode user location visible draw safe get location map drawing location set mode update drawing position,GPS prompts the app to deliver spoken descriptions and stories of the scenery and sights just outside your car window.,LOCATION
we need access to your location information to get your current position using GPS,Settings GPS ,get accuracy set longitude set latitude get longitude get latitude get time,Use this app to find out where the location Bami Gili closest to your location,LOCATION
"If you grant permission to use your device??s location, Provider will use the data when checking for nearby branch and ATM locations",Get all Location Locations Find Locations ATM Locations Branch Locations,set location enable location run enable location item selected draw location get last known location,ATMs and Banking Centers using the GPS system provided by your device,LOCATION
Access Fine Location permission is required,Add Location Search Current Location,set location run set latitude receive run set longitude receive get last known location set speed get speed,Switch between Map display modes,LOCATION
"we collect location information when you visit our sites or use our applications, including location information either provided by a mobile device interacting with one of our sites or applications, or associated with your IP address",Share your location Location Disabled  Go to Settings,set location get last known location get altitude,Glympse Express enables you to quickly share a temporary link so others can see your location on a live map,LOCATION
gps location is collected from the users who installs or run our app.,Longitude Latitude Get current location,restart get altitude item selected get longitude item selected get last known location,Able to display data based on your Network/GPS location,LOCATION
we need access to your location information to get your current position,View on Map Recenter Live Orders,get last known location get current position get available location run get speed request location map,Track your deliveries on a real-time map,LOCATION
"we may collect some sensitive data from your device, such as your location information.",Search Location,receive get last known location invoke get auto night mode manager set local night mode get current location data get last known location provider get current position configuration dispatch time map night mode start get last known location apply day night invoke get night mode ensure auto night mode manager night request location map,"The App also features branch location finder and you can also share your thoughts through social media, and share your opinion and feedback to Little Bangkok team.",LOCATION
"When you visit the mobile application, we may use GPS technology (or other similar technology) to determine your current location in order to determine the city you are located within and display a location map with relevant advertisements.",Location GPS Longitude GPS Latitude Search,add image run get latitude location save output get longitude add image run location save output get time get last known location ,"Powered by GPS, the app shows locations that are providing meals and meal packs, with days and hours for distribution. It also shows the distance and directions to the nearest site.",LOCATION
"Technical information, which includes certain information or characteristics regarding the operating system, including the type of ISP or the type of browser used, the Internet Protocol (IP), the IP address and the names and versions of the applications installed on the device, as well as the geographical location of the device (including GPS coordinates). Technical information such as the foregoing stays anonymous; in other words, it does not personally identify you or is stored together with any other information that may link it to the user itself, except when the user submits additional information voluntarily. This information shall be used to improve the application, learning how, when and where the user browses on it.",Filter Chats categories FAVORITES See More Chats,get data get last known location get data create run get longitude run get latitude create set accuracy,"Including public chat between farms registered, displayed neighbors near your location with possibility of publishing classified sales, create and attend events.",LOCATION
"Our Service may have the ability to use your geographic location to deliver content, services, and advertising tailored to your location. If you choose to enable our Service to use your location information, then that information will be stored and used to deliver content, services, and advertising tailored to your location.",Getting Current Location Failed to determine the current location unknown location Use Current Location,request location register handle intent process update set latitude set longitude run get time,A fully integrated GPS for current location awareness,LOCATION
we need access to your location information to get your current position,Need to turn on Internet or GPS to get location information,set listener set click get last known location get time,You can type @where in note string to display locate name. Type @city to display city name. And type @loc to display latitude and longitude. (Need to turn on Internet or GPS to get location information),LOCATION
"Sometimes our services require us to collect your location data (through GPS). If that is the case, you will be requested to grant consent beforehand.","User locations are used to calculate planned routes, find near by places and when checking in at parking places Get current location save location",get time get last location get location set get last known location ,Search by location and destination,LOCATION
"Technical information, which includes certain information or characteristics regarding the operating system, including the type of ISP or the type of browser used, the Internet Protocol (IP), the IP address and the names and versions of the applications installed on the device, as well as the geographical location of the device (including GPS coordinates). Technical information such as the foregoing stays anonymous; in other words, it does not personally identify you or is stored together with any other information that may link it to the user itself, except when the user submits additional information voluntarily.",Near Me Display on Map Search,create location get create location location get view set altitude set longitude run get last known location,"Near Me: This option allows to know the main attractions of culture, leisure and shopping close to the user and its location on the map.",LOCATION
"We may use GPS technology, wi-fi or other location-based services on our App to determine your current location. Some of our location-enabled services require your personal data for the feature to work. If you wish to use the particular feature, you will be asked to consent to your data being used for this purpose. You can withdraw your consent at any time by changing the location settings on your device.",Geographic coordinates Enter Address Directions Exit,request location run dispatch time configuration get time ensure auto night mode manager start get last known location set local night mode map night mode apply day night night receive ,"Easily find your nearist bistrot, with directions and contact details",LOCATION
"In addition, if you access the Service through one of our mobile applications, we may also be able to identify the location of your mobile device. You may choose not to share your location details with us by adjusting your mobile device's location services settings, or otherwise declining to provide access to your location when prompted to do so. For instructions on changing the relevant settings, please contact your service provider or mobile device manufacturer. If you choose not to share your location details with us, you may be denied access to the mobile application.",GPS Location Please check your device Settings and make sure you have GPS Location turned ON No Location Found Search,start get last known location start get distance get status set longitude start set latitude command run ,Product features include: GPS location monitorings,LOCATION
"In general, we use personal information we may collect (such as your name, location or social network information) to facilitate your use of the mobile application and Glympse service, to provide you with information, products and services you request, to administer and assist us with the operation of the Site, our app, and for any other purpose for which the information was provided. For example, we may use the information we collect:  ?? to respond to your emails, submissions, comments, requests or complaints; ?? to ensure that the application is working correctly and that you are being served the most recent version;?? to allow other users of the service that you designate to temporarily view your whereabouts in real-time;",Return to Menu Tap to return to the main menu. Loading user locations Share Map Request Pioneer Driving Distraction Tap to Choose,add location location location vehicle data update location update get last known location draw get accuracy get last known location move start add location location location location draw location ,Glympse for Auto is the fastest and easiest way to share your location to friends and family from your car.,LOCATION
"Custom service include, but not limited to, custom messages including Birthday wishes, push notification, track your location, responding to your queries.",Search Settings Turn On GPS,create run background get last known location,"Locate Branches, ATM's and Merchants with its route navigation.",LOCATION
"In serving you, we may use or store your precise geographic location, if you give us permission to do so. ",Locate Current Position Location GPS Tag,get provider location parse location get latitude get longitude,GPS Tag is an effective and easy-to-use app that can perform as a personal GPS tracker,LOCATION
"If you grant permission to use your device??s location, Provider will use the data when checking for nearby branch and ATM locations",Get all Location Locations Find Locations ATM Locations Branch Locations,get last known location get night mode run set longitude get location set latitude get location,Locate ATMs or branches and contact Lanco FCU customer service directly from the app.,LOCATION
Our mobile apps may use your device??s Global Positioning System (GPS) or other technology to locate a hotel near you and/or to provide you with other relevant location-based information and/or services.,CHANGE No Upcoming Reservations Found Get ready to make some memories with Choice Hotels! Get Current Location Search,get last known location,"Locate hotels by city, address, zip code, airport, popular attractions or your current location.",LOCATION
"To provide Services, location-based data related to the operation of your mobile phone or other wireless device used in connection with the Services (??Location Data??) is derived via your Communications Carrier, certain third-party service providers, or directly from the mobile device. Location Data is used on the mobile software application only while the application is running and in accordance with your privacy and opt-in settings. When you use this software to voluntarily upload and share Trips through the Services, information regarding your geographic location(s) may be accessed and disclosed through the software used with those Services. You agree to notify any other users associated with your website account of this feature. You control when your location is shared with others by managing the settings on the application.",Current Location Enter Location Find Location Search No Location Found Follow Me ON OFF Get Route,draw location get location drawing location location location draw draw safe draw location create fix bearing location get last known position get location drawing get fast fix position ,"Use the TNP mobile app to map, find, collect, and share field data.",LOCATION
"Location Information (e.g., information about your location or device such as city, state or zip code)
Where Do We Collect this Information From?
From you when using our services, such our interactive game sites.
Service Providers companies allowed to only use your personal information to provide services to us, including hosting our sites and mobile apps, securing our track facilities, analytics, and advertising).
Why Do We Collect this Information?
To customize your experience so that you receive relevant information about our services and products (e.g., upcoming events in your area, perks available near you, access to location-based social networks and communities, etc.)",Select Open Map Get Current Location,location get altitude get longitude get last known location get provider get time,"Complete with weekend schedules, an interactive GPS facility map, a friend finder and much more, this app will surely enhance your visit to The Glen.",LOCATION
gps location is collected from the users who installs or run our app.,My Location Tag Contacts Locate Me,get latitude get longitude ,You can also send any location on the map to a recipient and share it through the apps on your device.,LOCATION
"When a commercial service professional accepts a job at a particular location, then the engaging entity, on the date of the assignment, will have access to the location information that is tracked through the mobile application. We use this information to facilitate payment, confirm scheduling, and for purposes related to ensuring performance of the particular job.",Enable GPS Location,process location send message fill request handle result get latitude handle location format location fill handle result set time location run get speed,Capture technician GPS data,LOCATION
"When you visit the mobile application, we may use GPS technology (or other similar technology) to determine your current location in order to determine the city you are located within and display a location map with relevant specific information.",Delivery Location Select delivery location Done Continue More options Use Current Location Add,get location get last known location run,Restaurant locator and distance calculation from your location,LOCATION
"We collect only your current location, each time you open the app, so that we are able to show the important places around YOU and help you take a peek at the places around you.",Get Location Get Directions Details Distance Phone Website,request single update run force location update request location get location get latitude get longitude receive location,The permissions used are for 1. getting your location and fetching places details from Google!,LOCATION
Geolocation data: precise location information about a particular individual or device.,Enable the Location services from settings,get view run click get location click click get view get current location get view ,Place details with Images and direction from your location to place location,LOCATION
Access Fine Location permission is required,Search Add to Favorite Settings,request result get last known location ,"Find the best bars When you open the app, we will ask for permission for Tappear to locate you",LOCATION
"If you grant permission to use your device??s location, Provider will use the data when checking for nearby branch and ATM locations",search ATM Bank Get Directions Current Location,location timed location old run location login get best location get time better location get latitude get longitude ,Utilize GPS to get one-touch access and directions to ATM and banking center locations,LOCATION
Our mobile apps may use your device??s Global Positioning System (GPS) or other technology to locate a hotel near you and/or to provide you with other relevant location-based information and/or services.,Get Current Location Settings More Opention,request location get longitude get latitude set location set longitude set latitude,Location: Access by checking the customer's location to deliver the information available in the shops,LOCATION
"In serving you, we may use or store your precise geographic location, if you give us permission to do so. ",Location Enter Location Turn on GPS  Settings Current Location,receive get speed run receive transform run receive run get distance request location get time get last known location,"""Man overboard"" function that saves all necessary information on one and the same screen in your camera roll as emergency numbers, coordinates, map image of the current GPS position",LOCATION
we need access to your location information to get your current position,Enable Location in Settings Locations Near You,get location provider get longitude get latitude get night mode get last known location,Find locations near you that offer Vipassana Meditation courses ,LOCATION
"To provide Services, location-based data related to the operation of your mobile phone or other wireless device used in connection with the Services (??Location Data??) is derived via your Communications Carrier, certain third-party service providers, or directly from the mobile device. Location Data is used on the mobile software application only while the application is running and in accordance with your privacy and opt-in settings. When you use this software to voluntarily upload and share Trips through the Services, information regarding your geographic location(s) may be accessed and disclosed through the software used with those Services. You agree to notify any other users associated with your website account of this feature. You control when your location is shared with others by managing the settings on the application.",Get Location Location View Map This shows your location on the map. Settings,serialize click show ease camera build feedback event marker click reset set location mode get altitude map ready get position,"Use our mobile app to:-	Find bicycles using map-",LOCATION
"We also collect information about how our network and your devices are working, including the location of your wireless devices.",Add Location My Current Location Determining user accurate location Share Location Find your location Set Location Edit Location,get location get last known location subscribe last sync location valid set longitude set latitude get location object run set last known location ,lets you share your location with the people you choose for the length of time you set,LOCATION
Access Fine Location permission is required,"Please wait while getting your GPS location Please grant Location permission,for access your currnet location Current Location",get best provider get location get last known location,View events around you via GPS location,LOCATION
Geolocation data: precise location information about a particular individual or device.,Location Settings current location City State Zip code Save home,get last known location get time get accuracy,find homes based on your current location,LOCATION
"When you open the Application, we may use GPS technology (or other similar technology) to determine your current location and display a location map.",Show Weather Enter Location Get Current Location,get location run kill process get last known location run get location run ,Weathood is a simple weather app which will use your device GPS to detect your location and bring rich weather service,LOCATION
"We also collect information about how our network and your devices are working, including the location of your wireless devices.",Advanced Store Search Find Pharmacies Near Me Find Pharmacy Result State Select Search Find Your Location,get speed run get common run get location get longitude get latitude,find nearby stores to place a perscription refill request,LOCATION
Location data is used within the Lat Long Calc series of apps as part of what it does.,Close Prev Next Close Load GPS ,get accuracy location request location get latitude location get longitude location ,Lat Long Calc is a GPS tool that converts latitude/longitude coordinates to different formats and calculates distance and direction between two points,LOCATION
"Used for accessing the User's approximate and precise device location. This Application may collect, use, and share User location Data in order to provide location-based services.",Get Current Location Settings More Opention,get best provider request location get longitude location get latitude location get time,Location: Access by checking the customer's location to deliver the information available in the shops,LOCATION
