Our app need access to your device storage.,Select Save Tours Cancel,run get path get storage state create get external storage directory get file,You can download the tours but Preload easily downloaded from the Internet and use offline,STORAGE
we may request permission to access your device storage to save files.,save image to gallery cancel exit,window focus add view player window focus get external storage directory resume get absolute path resume run remove view player run,"You can download and print it, or you can scan it directly from the screen and save image to gallery.",STORAGE
"you need to provide us with your information, you acknowledge any such transfer, storage or use.",Programs Download Episode,get external storage directory get instance get authentication run get storage state path strategy get authorization import storage get instance parse path strategy dump get file open run import ,Save your favorite tv shows and episodes,STORAGE
this app requires write external storage permission to save audio files.,download your favorite ringtones select ringtones download,get external storage directory set path set click listener download,download best sms ringtones here for free,STORAGE
save downloaded wallpapers and themes to the storage of your device.,amazing wallpaper app select free download exit,click set action finish inflate set click listener set content view set click listener click get external storage directory set click listener select backgrounds request result load file,download hd wallpapers to stylize your device's home screen and make it unique,STORAGE
We need access your storage to store gameplay data of our app.,Game data is stored on your device,load event sound call externalize resource resize call get file get patch expansion file invoke parse path strategy extract asset file call open request permission get external file dirs get path set file path run ,Game data is stored on your device,STORAGE
"storage permission is used for accessing shared external storage, including the reading and adding of any items.",Take a Picture Save to File Select Image File,request camera permission run set click listener context item selected draw make single image get file path,"save business card with details, exchange with partners, update card in any time.",STORAGE
write external storage permission is needed for the app to perform its functionality.,select ringtones music free download return,set click listener click start download get path strategy get file get external storage directory closed run call initialize set manual attach get parse path strategy get storage state run ,Get these free music ringtones for Android ringing and free download awesome ringtones that will rock your body!,STORAGE
user need to grant storage permission to the app,Books Search select Download Library,backup contacts get external storage directory write file start run background get file path set path start,download books,STORAGE
our app request write external storage permission,Halloween Ringtones Select Save to your device ,set click listener click start download execute background get external storage directory get path update,download scary halloween ringtones for free,STORAGE
The contact backup is store locally in device storage. No information is transfered.,Export Contact Details Choose Format CSV CSA,back run set rating global layout back get view add information layout create banner receive run get external storage directory load set rating receive add information layout ,"this app stores your contacts locally in a compressed CSA file format, including profile images in their original size.",STORAGE
Access storage of your device,History select QR Code Return,get path strategy parse path strategy run set manual get storage state get file create interstitial manager attach get external storage directory ,"qr code will be stored, and you can remove all qr code from history.",STORAGE
permission needed: write external storage permission is used for synchronize files.,Select Folder Start Synchronize Complete,get external storage directory run background,sync everything to storage for offline use.,STORAGE
"we need permission to access device storage, for example photos and videos.",SMS Pictures Videos Emails Select OK Cancel Backup Select All,get storage state load get external storage directory load get file load load parse path strategy load get video instance run request interstitial request banner attach get path strategy get video instance ,"The SMS's, Pictures, Videos and Emails that has been sent is saved only on your phone.",STORAGE
all created files are saved in mobile storage. storage permission is only required to save generated backup files (xml and pdf).,Select Contact SMS Call Log Export to PDF Save,get external storage directory,Now you can get PDF backup,STORAGE
read external storage to read songs of your device. write external storage to save edited ringtones notification alarm tones.,Show All Ringtones make new ringtones delete audio file Save new ringtones,get external storage directory get file path select music write get path strategy get file attach connect write save share file ,read & write audio files on your device. files will be saved in sdcard/media/audio folder. create new ringtones or delete existing files,STORAGE
needed permission: read and write external storage.,Format Type Metadata Place a barcode inside the viewfinder rectangle to scan it. Open Camera Select Image from Storage,request permission get external file dir get path get file resize request camera open,scan qr code or barcode from saved images.,STORAGE
we need access to your storage of your device.,"PC Sync allows to synchronize your Calendar, Contacts, To Dos, Notes and Password entries with EssentialPIM",get external storage directory set view pager click create form attach files,You can now store any external files to your device or to any online service.,STORAGE
Your storage of device will be accessed and written by our application in order to provice you with better functionality.,Free Music Ringtones Download Now,set click listener select item set click listener download get available storage space check writable get cache directory write,"select your favorite ringtones, download them for free",STORAGE
the application also requires access (read and write) to users external storage to be able to open file with saved project.,Get Contact Select Backup Contact Choose Folder Start,get external storage directory item selected mode set click listener backup get file path set click listener get external backup folder set click listener click save backup,"Save files from dropbox, google drive. Build-in file manager for opening projects from SD card and internal storage",STORAGE
This app processes data from your device storage. Need for write external storage permission.,Camera Save Contacts Return,activity result run get external storage directory call take picture run run get file name item selected parse path strategy get path strategy get real path take picture run get scaled rotated get free external storage space get file get storage state get external storage directory,"You can also save other attachments, notes or the photo of the back of the business card in the app for a later export.",STORAGE
Your storage of device will be accessed and written by our application in order to provice you with better functionality.,Top Ringtones Select Save to Local,get external storage directory set click listener click save file append,download ringtones and mp3 ringtones for your Android device,STORAGE
"by accepting our privacy policy and terms of service, you consent to our collection, storage, use and disclosure of your personal information as described in this privacy policy.",Quran Mp3 Ringtones Search Add to Favorite Download Now,start command bind view holder get external cache dispatch load complete execute get icon set click listener create tab view start support action mode window add tab get external storage directory,"If you are tired of the old standard ringtones and SMS sounds, download Quran Mp3 Ringtones.",STORAGE
Access your device storage to save exported backup files,Get Contact Select Backup Contact Choose Folder Start,get external storage directory get external cache get file get path strategy get storage state attach get external get parse path strategy ,"Restoring or changing contacts from the spreadsheet is as simple as uploading the file to your phone via USB, email, Dropbox, Google Drive or Box.",STORAGE
"with mediafire, you get simple yet powerful file storage.",Contacts select select all save as cancel Main Page,set click listener run set click listener set click listener parse path create new file get external storage directory,Allows an application to write to external storage. used in application to save Contacts on your phone as file.,STORAGE
this app need write external storage to save downloaded materials such as video and audio data. No data is transfered or stored outside your phone.,Get Contact Select Backup Contact Choose Folder Start,run set click listener create video get external storage directory get path set file path run background download,We read user contact data regularly to download video/voicemails from your friends in contacts.,STORAGE
This app requires write external storage permission to save audio files.,Most Popular Ringtones 2017 Loading ... Save Cancel,request permission get external storage directory get path save item,"Ringtone maker and ringtone downloader with funny ringtones, save the ringtones and use them as sms alert, notifications and so on.",STORAGE
user need to grant access to device storage.,Get Contact Select Backup Contact Choose Folder Start,get external cache abort get external get path strategy initialize get get storage state parse path strategy create file click save get file path,"It is meant to store your phone contacts in a more readable file so that it can be printed later on on a Printer, for instance.",STORAGE
permission to access device storage is required.,Select Folder Select Files Copy Paset Cut Move Delete,activity result service connected set click listener request result run get external storage directory click run,"Cut, copy, move, paste, delete multiple items using the integrated explorer of this application",STORAGE
save contacts as a file in the storage of your phone/device.,Contacts Select Export Select Folder Start,initialize write file public directory test file get file run get external storage directory run run get path strategy get storage state parse path strategy run run get available file attach get free external storage space get external cache get request run get external need permission run ,you can export your contacts to a local file.,STORAGE
"by accepting our privacy policy you consent to our collection, storage, use and disclosure of your personal information as described in this privacy policy.",Image Video Camera Music Folder All Files Local Backup History Show Backup from all Devices Add file to backup Create new backup No Backup Found ,request permission run background start backup get external storage directory get path save,"Store your frequently used data, access them instantly and utilise them efficiently.",STORAGE
our app request write external storage permission,Islamic Ringtones Free Download,get cache directory call get external cache get cache directory create default create reserve disk cache get individual cache directory create interstitial manager get storage state create new get external storage directory,hurry to the market and download this free collection of Islamic ringtones and sounds and download amazing ringtones for free,STORAGE
This app saves all files locally on device storage.,New Ringtones 2015 Free Download Save Cancel,request storage permission check available storage space get file dir set click listener set view select item click download set file path run background,"The best top songs can easily be yours now, just hit the download button!",STORAGE
"device storage data: since appseed infotech provides app(s) for the entertainment purpose, we may access and/or collect user's device storage data such as images, videos, and other data files.","Hide Photos, Videos And Contacts Dialer Vault No Files Found Click on + button to add files ",set click listener get external storage directory create new attach get storage state set click listener click delete file delete set click listener click hide file,"This app requires storage permission to provide you some functionalities like hide/unhide files, delete and add files, share files as per your action taken.",STORAGE
The app need access device storage,Select Save Cancel,get external storage free size run start write file get external storage directory set position run background download set click listener start downloading,Download SMS Ringtones and Sounds for Android app and enjoy the best SMS Ringtones and Sounds for Android and free message tones.,STORAGE
"this app store audio files to your device storage, therefore we need user to grant write external storage permission to the app",Horror Ringtones Scary Sounds Download for Free,run get individual cache directory get path strategy run get cache directory call get external cache get cache directory create new get external storage directory ,download these horror ringtones for free and enjoy,STORAGE
access to device storage. ,select photo save select folder,run save image get external storage directory set file path save,Save images,STORAGE
this app use storage permission,share backup select return ok exit,click share file activity result get create view update profile get native file path enroll get external storage directory,"Simply share files and folders in DirectBox by a link with others or Backup your smartphone photos, documents, videos to the cloud and use them anytime when you want ",STORAGE
"we may ask you to provide us with certain personally identifiable information such as camera, photo gallery, storage that can be used to run the application normally",select photo edit save photo refresh return,back save get cache directory get cache directory get individual cache directory set click create default picture taken get cache directory,they can able to edit image or open image from storage easily,STORAGE
required permission: storage,download return,run get external storage directory,download and pay your bill,STORAGE
request to access device storage information,view programs add to calendar download return refresh back to main page,create calendar event execute raid fetch play audio load web content seek audio set hand shake attached window run track conversion start recording post social execute restore instance state insert meta mute video get external cache directory,This is the app for the IWCS International Cable Symposium It will allow you to download the program,STORAGE
write_external_storage: it uses to display ads,save,get external storage directory,write external storage: it uses to show ads,STORAGE
access to device storage. ,download,refresh total external storage publish install wait response populate request refresh available external storage run run set event extended device run run get object graph call build request session send server flush wait refresh periodic extended device get external storage directory populate request ,The devotions can be read off-line and hopefully the bible verses will be fetched and stored locally too for reading - though only the current day,STORAGE
storage access is required by this app,not enough space refresh please delete some file to free space,get cache directory create default get phone path get individual cache directory get cache directory get cache directory create get external create disc cache get external cache image loader empty default get external cache get external storage directory build ,this app requires read and write external storage permission.,STORAGE
this app requires read and write external storage permissions.,you can download the video and watch later offline download you do not have enough space,get available storage space update file cache size limit remove clear maybe evict cache insert external insert test low disk space create storage get external storage directory get ensure get start insert get resource ,Watch later functionality to save and watch the videos laters,STORAGE
the app needs access to storage so that you can download files.,the app saves your login credentials and your data locally,event bind view holder start login publish like get external storage directory,"downloaded data updates, your personal notes or stars, or your login credentials require the app to have permissions to external storage",STORAGE
access to device storage is required when using the app,play pause save add favourites add list view cancel exit,play ringtone bottom run animation end click get external storage directory,"Your favourite tunesLike the song currently playing? Add it to your favourites, listen to it later or download it ",STORAGE
write_external_storage : to save photos,save photo cancel,save image get external storage directory create request result view save load finished get external cache load finished create close image save image loader reset click save image click click get external get view ,save photo to device storage,STORAGE
"to save photos to the device, the app first need access to your device storage.",save image return exit,get available file run initialize get external storage directory public directory run get temp directory path run get free external storage space write file execute run need permission run request ,The app also allows you to save marked-up images,STORAGE
the app needs access to storage so that you can download files.,booking voucher save go back,refresh available external storage set event extended device run get external storage directory run get object graph call refresh periodic extended device refresh total external storage,storage access: to save your booking voucher,STORAGE
"storage permission used for accessing shared external storage, including the reading and adding of any items.",message will be saved in local database and send it later quit,run get external storage directory,Store message to local database and send it later,STORAGE
read external storage allows users to select files to upload.,save photo share open gallery,get external storage directory ,you can share any image with your friends on social networks or save it to your photo gallery,STORAGE
"write external storage permission is required to save photos and videos, we do not share your information.",college photo editor eidt open save image,activity result click get view execute background activity result get view click execute get view post execute background execute execute request result execute background click click background get external storage directory,Instantly save the collage and share it on any social networking platform,STORAGE
write_external_storage: to store user's ringtones,save as ringtone notification alarm cancel exit,get external storage directory,"All sounds can be saved as Ringtones, Notifications and Alarms",STORAGE
we allow you to download content and store it on your device in your usb storage,songs albums view downloads return,get external storage directory activity result ,"In the offline mode user can look through all sermons and albums, and listen to all downloaded tracks",STORAGE
"we only require read and write external storage permission, we do not modify or delete content to your storage space.",save as file select folder,background item selected click save multiple load folder execute background folder load folder execute click get external storage directory,read and write storage permission for save the data as file,STORAGE
access to device storage. ,create open save help settings return,create run background get external storage directory,"create a new program file, open, save,automatically save file",STORAGE
write storage permission is used for saving downloaded files to external storage.,documents view statements download back,start create finish inflate request result size get view click get external storage directory,View and download your account and personal/home finance statement as well as Credit Card statement,STORAGE
"write external storage: add, modify or delete the contents of your storage",app settings are save locally,run get external storage directory,storage - for saving app settings to the phone,STORAGE
we allow you to download content and store it on your device in your usb storage,download,click get content start run get external storage directory,Work offline by downloading content,STORAGE
"to save files to your device, the app require to access device external storage.",view articles save share exit,click execute executor execute executor initialize like button account sign run get external storage directory,"Save articles and viral stories for reading later, and share on Facebook and Twitter",STORAGE
"to save files to your device, the app require to access device external storage.",articles save articles share exit,click execute executor execute executor initialize like button account sign run get external storage directory,"Save articles and viral stories for reading later, and share on Facebook and Twitter ",STORAGE
our app uses storage permission to save edited photos,edit save open gallery select ok cancel,get external storage directory run click get gallery get image list,Editing photos in your phone gallery very easy Select a photo from the gallery to edit Save photo into phone's gallery,STORAGE
access storage data,storage information,get external storage directory,mobile info is to display information about your device such as: storage info,STORAGE
this app use storage permission,save to album exit,set get external storage directory ,Save your creation to App Gallery or your SD card,STORAGE
"to save photos to the device, the app first need access to your device storage.",wallpapers save to gallery exit,background resource ready create view holder display image set native configuration render get external storage directory crop save image execute process input get image absolute path,Save wallpaper to photo gallery,STORAGE
"Some of our applications may use read and write storage permissions to access Media files form USB storage. We don??t collect, store or share information.",create edit save delete refresh return main page,item selected save path click add menu button bind view holder background execute create view holder run handle intent get external storage directory bind view holder execute dashboard page click bind view holder execute item navigation item selected execute,"Create, save, load, and delete multiple Recipe Profiles",STORAGE
"permission to access, modify, delete content in external storage is required.",create new add save photo edit return,create run get external storage directory,"Create custom categories, log item purchase date and cost, store photos, and make notes",STORAGE
the app needs access to storage so that you can download files.,recordings download,create set path run get external storage directory,download recordings to a usb storage,STORAGE
required permission write external storage,backup restore contacts photos and videos calendars documents select folder cancel,background item selected click save multiple load folder execute background select date set folder mode click get external storage directory execute executor set filter closed,storage: used to upload / download files and images,STORAGE
permission required by this app: read external storage and write external storage,Edit Apply Save Image Cancel,get external storage directory create view holder item click set view query click bind view holder set video call configuration set view click detached window set content,Select a romantic photo from the gallery of your phone and use this image editor to decorate it!Save your new picture and share it instantly on social networks like Facebook or Twitter!,STORAGE
access to device storage. ,select images save image cancel select folder,create storage get external cache get cache directory get external storage directory set wallpaper bind view,you can save all pictures to sd card or cloud storage accounts,STORAGE
access to device storage to store downloaded files,view download,run get external storage directory run run,"After you've downloaded and enjoyed the content, you can share it with your friends via Twitter, Facebook, or email",STORAGE
access your device storage to save pictures,save photo take picture gallery,request permission result process run get external storage directory ,Snap a photo of your look and save it to your device,STORAGE
"write external storage permission is required to save photos and videos, we do not share your information.",take picture save gallery select photo return exit,get external storage directory run request output process result gallery restore state activity result activity result call take picture get file name run get real path run execute write file,"Galaxy Camera app can take impressive photos and save the moment at any time, any place",STORAGE
"we may ask you to provide us with certain personally identifiable information such as camera, photo gallery, storage that can be used to run the application normally",open gallery take picture save exit,run get external storage directory get provider set content view activity result get contact list,Import photos from gallery or take from camera,STORAGE
access your device storage to save pictures,save image to album,run get external storage directory run,Select a photo from the gallery to editSave photo into phone's gallery,STORAGE
